[
    {
        "name": "Sign",
        "desc": "Put up a sign above entrance. Sensible advertisement for every brothel that you own. You obviously pay full fee for this only once and then 10% of the fee if you removed the sign for some reason and put it up again.",
        "price": 200,
        "fame": [0, 1]
    },
    {
        "name": "Flyers",
        "desc": "Hire someone to handout flyers in the city. You will pay fee for this service each day",
        "upkeep": 30,
        "fame": [0, 1]
    },
    {
        "name": "Magazine",
        "desc": "Put an advertisement in local 'Playdude' magazine. Target your audience for a modest fee. Will cost you an amount of gold each day",
        "upkeep": 50,
        "fame": [2, 3]
    },
    {
        "name": "Billboard",
        "desc": "Get some pro's to put a large billboard on the road to city. Upkeep and rent will cost you a daily fee",
        "upkeep": 100,
        "fame": [0, 2]
    },
    {
        "name": "Girl",
        "desc": "Hire a pretty girl to attact clients into your buildings. This will cost you 50 once and 150 a day.",
        "price": 50,
        "upkeep": 150,
        "fame": [0, 1],
        "reputation": [0, 2]
    },
    {
        "name": "Celebrity",
        "desc": "Pay a celebrity to come into your building and publicly endorse it! You will pay 5000 once and 1000 a day to keep her.",
        "price": 5000,
        "fame": [50, 100],
        "reputation": [50, 100]
    }
]
